{
  "$schema": "../../../../schemas/gate-result.schema.json",
  "schema_version": "1.0",
  "task_id": "2026-08-03-harness-v6-hybrid-engineering",
  "gate": "ai_llm",
  "phase": "pre_release",
  "revision": 2,
  "status": "passed_with_conditions",
  "applicability": {"applicable": true, "reason": "Prompts and authority memory change generation, refusal, resumption, and handoff behavior."},
  "summary": "Models must read the truth index and active task, refuse single-file monolith requests constructively, preserve thin entrypoints, and avoid treating missing summaries as authority to destroy verified work.",
  "checks": [
    {"id": "behavior_contract", "status": "passed", "evidence_refs": ["qualification"], "notes": "Twenty-seven pinned structural behavior cases and local assertions are present; host/model execution remains a rollout condition."}
  ],
  "findings": [
    {"id": "AI-01", "title": "Behavior remains unqualified across target models and hosts", "severity": "high", "state": "deferred", "blocking": false, "evidence_refs": ["qualification"], "required_action": "Execute the pinned behavior suite on each intended model and host before broad rollout.", "owner": "Harness rollout owner", "due_before": "post_release", "risk_acceptance_ref": null}
  ],
  "evidence": [
    {"id": "qualification", "kind": "test", "pointer": "docs/harness/QUALIFICATION-6.0.md", "summary": "Pinned fixture integrity and local structural behavior evidence.", "redacted_excerpt": null, "sensitivity": "internal", "redacted": false, "sha256": null, "captured_at": "2026-08-03T18:00:00-03:00"}
  ],
  "acceptance_criteria_added": [],
  "artifacts": ["docs/harness/evaluation-cases.json", "docs/harness/evaluation-fixtures.json", "docs/harness/QUALIFICATION-6.0.md"],
  "sources": [],
  "approval": {"required": false, "reason": "The source release may retain a disclosed host/model qualification condition.", "status": "not_required", "evidence_ref": null},
  "handoff": ["Execute the pinned suite per intended model and host before broad rollout."],
  "generated_at": "2026-08-03T18:00:00-03:00",
  "expires_at": null
}
